title,buy_button
"DENTALIFE® Large, za negu zuba, poslastice za velike pse",True
"PRO PLAN® SENSITIVE SKIN, bogato lososom, srednje veličine, suha hrana za pse",True
"PRO PLAN® SENSITIVE SKIN, bogato lososom, velike robusne veličine, suha hrana za pse",True
"FRISKIES® JUNIOR, sa piletinom i šargarepom, vlažna hrana za štence",True
"DENTALIFE® Small, za negu zuba, poslastice za male pse",True
"PRO PLAN® PERFORMANCE, bogata piletinom, sve veličine, suva hrana za pse",True
"DOG CHOW® PUPPY, LARGE BREED, sa curetinom, suva hrana za štence",True
"FRISKIES® ADULT, sa govedinom/piletinom/jagnjetinom, vlažna hrana za pse",True
"DARLING® ADULT, sa govedinom, piletinom i povrćem, suva hrana za pse",True
"PRO PLAN® ADULT 7+ SENSITIVE SKIN, bogato lososom, srednje i velike veličine, suha hrana za starije pse",True
"DOG CHOW® ADULT, LARGE BREED, sa curetinom, suva hrana za pse",True
"FRISKIES ® ADULT, sa govedinom i šargarepom, vlažna hrana za pse",True
"DENTALIFE® Medium, za negu zuba, poslastica za srednje pse",True
"PRO PLAN® EVERYDAY NUTRITION, bogata piletinom, velike robusne veličine, suva hrana za pse",True
"PRO PLAN® SENSITIVE DIGESTION, bogata ćuretinom, male i veoma male, hrana za pse bez žitarica",True
"FRISKIES® ADULT, sa govedinom i krompirom, vlažna hrana za pse",True
"DENTALIFE® Large, za negu zuba, poslastice za velike pse",True
"PRO PLAN® SENSITIVE SKIN, bogato lososom, srednje veličine, suha hrana za pse",True
"PRO PLAN® SENSITIVE SKIN, bogato lososom, velike robusne veličine, suha hrana za pse",True
"FRISKIES® JUNIOR, sa piletinom i šargarepom, vlažna hrana za štence",True
"DENTALIFE® Small, za negu zuba, poslastice za male pse",True
"PRO PLAN® PERFORMANCE, bogata piletinom, sve veličine, suva hrana za pse",True
"DOG CHOW® PUPPY, LARGE BREED, sa curetinom, suva hrana za štence",True
"FRISKIES® ADULT, sa govedinom/piletinom/jagnjetinom, vlažna hrana za pse",True
"ADVENTUROS® TRAINING, sa ukusom divljeg mesa, poslastica za pse",True
"FRISKIES® Mini Menu, suva hrana za pse, piletina i povrće",False
"PRO PLAN® SENSITIVE SKIN, bogata lososom, male i veoma male, suva hrana za pse",True
"DOG CHOW® PUPPY, sa piletinom, suva hrana za štence",True
"FRISKIES® T-BONZ, sa govedinom, poslastice za pse",False
"FRISKIES® PICNIC, sa piletinom, poslastice za pse",True
"PRO PLAN® SENSITIVE SKIN, bogato lososom, srednje veličine, suha hrana za štence",True
"DOG CHOW® SENSITIVE, sa lososom, suva hrana za pse",True
"FRISKIES® BEGGIN' STRIPS, sa govedinom, poslastice za pse",True
"FRISKIES® PICNIC, sa govedinom, poslastice za pse",True
"PRO PLAN® HEALTHY START, bogata piletinom, velike robusne veličine, suva hrana za štence",True
"DOG CHOW® ADULT, sa piletinom, suva hrana za pse",True
"FRISKIES® DIGESTION, sa govedinom, jagnjetinom i cikorijom, suva hrana za pse",True
"FRISKIES® PICNIC VARIETY, poslastice za pse",True
"PRO PLAN® HEALTHY START, bogata piletinom, velike atletske veličine, suva hrana za štence",True
"PRO PLAN® ADULT 9+ AGE DEFENCE, bogata piletinom, male i veoma male, suva hrana za starije pse",True
"FRISKIES® JUNIOR, sa piletinom i povrćem, suva hrana za štence",False
"FRISKIES® FUNTASTIX, poslastice za pse",True
"PRO PLAN® EVERYDAY NUTRITION, bogata piletinom, velike atletske veličine, suva hrana za pse",True
"PRO PLAN® SENSITIVE DIGESTION ADULT, bogata ćuretinom, srednji i veliki, hrana za pse bez žitarica",True
"FRISKIES® Mini Menu, sa govedinom, suva hrana za pse",True
"DENTALIFE® Medium, za negu zuba, poslastica za srednje pse",True
"PRO PLAN® EVERYDAY NUTRITION, bogata piletinom, velike robusne veličine, suva hrana za pse",True
"PRO PLAN® SENSITIVE DIGESTION, bogata ćuretinom, male i veoma male, hrana za pse bez žitarica",True
"FRISKIES® ADULT, sa piletinom i šargarepom, vlažna hrana za pse",True
"PURINA ONE® MINI Active, sa piletinom i pirinač, suva hrana za pse",True
"PRO PLAN® SENSITIVE DIGESTION, bogata jagnjetinom, srednje veličine, suva hrana za štence",True
"PURINA ONE® MINI Adult, sa piletinom, šargarepom i boranijom, vlažna hrana za pse",True
"FRISKIES® JUNIOR, sa piletinom i graškom u želeu, vlažna hrana za štence",True
"PRO PLAN® SENSITIVE DIGESTION ADULT, bogata jagnjetinom, srednje veličine, suva hrana za pse",True
"PRO PLAN® HEALTHY START, bogata piletinom, srednje veličine, suva hrana za štence",True
"PURINA ONE® MINI Active, sa govedinom i krompir, šargarepa, vlažna hrana za pse",True
"FRISKIES® ADULT, sa piletinom i šargarepom u sosu, vlažna hrana za pse",True
"PRO PLAN® SENSITIVE DIGESTION ADULT, bogata jagnjetinom, male i veoma male, suva hrana za pse",True
"PRO PLAN® SENSITIVE DIGESTION, bogata jagnjetinom, velike atletske veličine, suva hrana za pse",True
"DOG CHOW® PUPPY, sa jagnjetinom, suva hrana za štence",True
"FRISKIES ® ADULT, sa govedinom i šargarepom, vlažna hrana za pse",True
"PURINA ONE® MNI Adult, sa govedinom i pirinčem, suva hrana za pse",True
"PRO PLAN® HEALTHY START JUNIOR, bogata piletinom, male i veoma male, suva hrana za štence",True
"PURINA ONE® MINI Adult, sa piletinom/govedinom, krompirom i graškom, vlažna hrana za pse",True
"FRISKIES® ADULT, sa piletinom i šargarepom, vlažna hrana za pse",True
